{"format":"posetrack","version":1,"source":"mediapipe-pose-full","exercise":"bicep_curl","mirrored":false,"coordinateFrame":"mediapipe_world","up":{"source":"image_vertical","vector":[0.0,-1.0,0.0]},"confidenceScale":"mediapipe_visibility","joints":["l_shoulder","r_shoulder","l_elbow","r_elbow","l_wrist","r_wrist","l_hip","r_hip","l_knee","r_knee","l_ankle","r_ankle"],"clip":"IMG_5970.mov","frames":[{"t":0.0,"positions":[[-0.1737,-0.4016,0.0268],[-0.2638,-0.2807,-0.2715],[-0.102,-0.1939,0.0703],[-0.2335,0.0041,-0.2949],[0.058,-0.061,0.0391],[-0.1612,0.2761,-0.2793],[0.0293,-0.0392,0.1055],[-0.0269,0.0349,-0.1055],[0.3261,-0.0294,0.2012],[0.3939,-0.0971,-0.0679],[0.3435,0.177,0.3203],[0.3608,0.1679,0.1836]],"confidence":[0.999,1.0,0.07,0.995,0.102,0.956,0.999,0.999,0.461,0.802,0.071,0.145],"angles":{"l_elbow":143.19,"r_elbow":168.21,"l_shoulder":10.03,"r_shoulder":40.77,"l_hip":122.74,"r_hip":109.83,"l_knee":104.44,"r_knee":75.94,"trunk_lean":36.59},"origin":{"l_elbow":"observed","r_elbow":"observed","l_shoulder":"observed","r_shoulder":"observed","l_hip":"observed","r_hip":"observed","l_knee":"observed","r_knee":"observed","trunk_lean":"observed"}},{"t":33.3,"positions":[[-0.2526,-0.3913,0.0172],[-0.3006,-0.2511,-0.2717],[-0.1817,-0.1935,0.0808],[-0.2708,0.0332,-0.3151],[-0.031,-0.0523,0.0867],[-0.2023,0.2836,-0.2877],[0.0191,-0.039,0.1014],[-0.0225,0.0366,-0.099],[0.3392,-0.0178,0.1822],[0.3455,-0.0695,-0.0557],[0.3029,0.1896,0.3053],[0.3254,0.1874,0.1622]],"confidence":[0.999,1.0,0.066,0.994,0.1,0.945,0.999,0.999,0.462,0.808,0.078,0.176],"angles":{"l_elbow":149.27,"r_elbow":162.65,"l_shoulder":18.44,"r_shoulder":49.05,"l_hip":132.52,"r_hip":118.17,"l_knee":91.93,"r_knee":78.82,"trunk_lean":43.48},"origin":{"l_elbow":"observed","r_elbow":"observed","l_shoulder":"observed","r_shoulder":"observed","l_hip":"observed","r_hip":"observed","l_knee":"observed","r_knee":"observed","trunk_lean":"observed"}},{"t":66.7,"positions":[[-0.3176,-0.3571,0.0059],[-0.2967,-0.2543,-0.2928],[-0.271,-0.0998,0.0386],[-0.2666,0.0297,-0.3137],[-0.1756,0.0789,0.0028],[-0.2001,0.2715,-0.2775],[0.0155,-0.0393,0.1014],[-0.02,0.0378,-0.0992],[0.3119,0.0148,0.2123],[0.2918,0.0027,-0.0097],[0.2909,0.2204,0.3858],[0.3258,0.2515,0.1768]],"confidence":[0.999,1.0,0.07,0.994,0.107,0.947,0.997,0.998,0.451,0.801,0.078,0.19],"angles":{"l_elbow":155.31,"r_elbow":164.5,"l_shoulder":35.86,"r_shoulder":46.98,"l_hip":146.94,"r_hip":129.85,"l_knee":106.18,"r_knee":100.48,"trunk_lean":47.89},"origin":{"l_elbow":"observed","r_elbow":"observed","l_shoulder":"observed","r_shoulder":"observed","l_hip":"observed","r_hip":"observed","l_knee":"observed","r_knee":"observed","trunk_lean":"observed"}},{"t":100.0,"positions":[[-0.3202,-0.3631,-0.0158],[-0.3115,-0.2565,-0.314],[-0.2694,-0.115,0.0383],[-0.2589,0.0269,-0.3164],[-0.1557,0.0365,0.0065],[-0.1963,0.2579,-0.2834],[0.016,-0.0425,0.1014],[-0.0201,0.0411,-0.0989],[0.306,0.0738,0.2406],[0.2485,0.1198,0.0428],[0.2588,0.3046,0.408],[0.3226,0.3196,0.2321]],"confidence":[0.998,1.0,0.067,0.993,0.101,0.949,0.996,0.998,0.431,0.774,0.077,0.19],"angles":{"l_elbow":146.85,"r_elbow":170.47,"l_shoulder":33.92,"r_shoulder":42.8,"l_hip":157.22,"r_hip":153.99,"l_knee":111.64,"r_knee":134.3,"trunk_lean":48.96},"origin":{"l_elbow":"observed","r_elbow":"observed","l_shoulder":"observed","r_shoulder":"observed","l_hip":"observed","r_hip":"observed","l_knee":"observed","r_knee":"observed","trunk_lean":"observed"}},{"t":133.3,"positions":[[-0.3216,-0.3669,-0.0311],[-0.3185,-0.2523,-0.3275],[-0.27,-0.1237,0.0298],[-0.2555,0.0259,-0.3223],[-0.1374,0.0184,0.0101],[-0.1889,0.2591,-0.2963],[0.0163,-0.0434,0.1014],[-0.0199,0.0421,-0.0987],[0.313,0.0726,0.2379],[0.2565,0.124,0.0358],[0.2355,0.3135,0.4125],[0.2859,0.3355,0.225]],"confidence":[0.998,1.0,0.065,0.993,0.097,0.952,0.995,0.997,0.424,0.773,0.083,0.215],"angles":{"l_elbow":143.51,"r_elbow":174.02,"l_shoulder":33.16,"r_shoulder":41.6,"l_hip":157.67,"r_hip":154.73,"l_knee":105.67,"r_knee":124.11,"trunk_lean":49.83},"origin":{"l_elbow":"observed","r_elbow":"observed","l_shoulder":"observed","r_shoulder":"observed","l_hip":"observed","r_hip":"observed","l_knee":"observed","r_knee":"observed","trunk_lean":"observed"}},{"t":166.7,"positions":[[-0.3439,-0.3581,-0.0236],[-0.3207,-0.2572,-0.3246],[-0.2967,-0.0907,0.0314],[-0.255,0.0176,-0.3208],[-0.1797,0.0225,0.0377],[-0.1873,0.2443,-0.2954],[0.0131,-0.0411,0.1033],[-0.0157,0.0402,-0.0988],[0.2722,0.1445,0.2709],[0.2547,0.1268,0.0579],[0.2468,0.3471,0.4419],[0.2971,0.3305,0.2424]],"confidence":[0.998,1.0,0.063,0.993,0.094,0.952,0.993,0.997,0.397,0.748,0.079,0.214],"angles":{"l_elbow":143.19,"r_elbow":173.77,"l_shoulder":37.49,"r_shoulder":41.13,"l_hip":166.0,"r_hip":156.7,"l_knee":128.48,"r_knee":130.04,"trunk_lean":50.68},"origin":{"l_elbow":"observed","r_elbow":"observed","l_shoulder":"observed","r_shoulder":"observed","l_hip":"observed","r_hip":"observed","l_knee":"observed","r_knee":"observed","trunk_lean":"observed"}},{"t":200.0,"positions":[[-0.3396,-0.3577,-0.0202],[-0.3224,-0.2579,-0.32],[-0.2833,-0.106,0.0376],[-0.2542,0.0167,-0.3112],[-0.1532,0.0151,0.0538],[-0.1798,0.2439,-0.284],[0.0121,-0.0412,0.1031],[-0.0145,0.0403,-0.0987],[0.2702,0.1221,0.2658],[0.2584,0.1588,0.0521],[0.2501,0.345,0.4282],[0.3109,0.3736,0.2338]],"confidence":[0.998,1.0,0.062,0.993,0.09,0.954,0.99,0.996,0.382,0.737,0.078,0.217],"angles":{"l_elbow":145.21,"r_elbow":173.71,"l_shoulder":34.43,"r_shoulder":39.85,"l_hip":163.84,"r_hip":161.67,"l_knee":127.03,"r_knee":134.73,"trunk_lean":50.44},"origin":{"l_elbow":"observed","r_elbow":"observed","l_shoulder":"observed","r_shoulder":"observed","l_hip":"observed","r_hip":"observed","l_knee":"observed","r_knee":"observed","trunk_lean":"observed"}},{"t":233.3,"positions":[[-0.3376,-0.3595,-0.0176],[-0.3285,-0.2577,-0.3107],[-0.2751,-0.1133,0.0398],[-0.2529,0.0174,-0.3044],[-0.1403,0.0047,0.0535],[-0.17,0.2448,-0.279],[0.0125,-0.0421,0.103],[-0.0147,0.0406,-0.0975],[0.2764,0.101,0.2454],[0.2683,0.1103,0.0393],[0.2348,0.3178,0.4203],[0.288,0.3344,0.2195]],"confidence":[0.998,1.0,0.06,0.992,0.087,0.954,0.99,0.996,0.368,0.734,0.078,0.231],"angles":{"l_elbow":144.86,"r_elbow":173.37,"l_shoulder":32.64,"r_shoulder":38.93,"l_hip":163.02,"r_hip":153.26,"l_knee":118.71,"r_knee":119.61,"trunk_lean":50.36},"origin":{"l_elbow":"observed","r_elbow":"observed","l_shoulder":"observed","r_shoulder":"observed","l_hip":"observed","r_hip":"observed","l_knee":"observed","r_knee":"observed","trunk_lean":"observed"}},{"t":266.7,"positions":[[-0.3521,-0.36,-0.016],[-0.3397,-0.2531,-0.3097],[-0.2744,-0.1791,0.0855],[-0.2499,0.0277,-0.3044],[-0.1441,-0.1434,0.0947],[-0.158,0.2581,-0.2826],[0.0115,-0.0422,0.1029],[-0.0124,0.0406,-0.0979],[0.2802,0.0997,0.2436],[0.2743,0.1188,0.0417],[0.2441,0.3356,0.4124],[0.2945,0.3378,0.2189]],"confidence":[0.998,1.0,0.057,0.992,0.084,0.956,0.989,0.995,0.361,0.73,0.079,0.234],"angles":{"l_elbow":125.73,"r_elbow":174.34,"l_shoulder":27.39,"r_shoulder":38.27,"l_hip":163.31,"r_hip":155.97,"l_knee":119.05,"r_knee":120.92,"trunk_lean":51.4},"origin":{"l_elbow":"observed","r_elbow":"observed","l_shoulder":"observed","r_shoulder":"observed","l_hip":"observed","r_hip":"observed","l_knee":"observed","r_knee":"observed","trunk_lean":"observed"}},{"t":300.0,"positions":[[-0.3589,-0.3584,-0.0192],[-0.3381,-0.2516,-0.3227],[-0.2829,-0.1659,0.0852],[-0.2514,0.0267,-0.313],[-0.1341,-0.1303,0.0941],[-0.1561,0.2518,-0.2837],[0.0118,-0.0424,0.1044],[-0.0125,0.0423,-0.0983],[0.2616,0.1491,0.3057],[0.2463,0.1679,0.0978],[0.2938,0.3703,0.5155],[0.3013,0.3842,0.3262]],"confidence":[0.997,1.0,0.055,0.992,0.086,0.956,0.987,0.995,0.341,0.722,0.076,0.243],"angles":{"l_elbow":122.51,"r_elbow":172.52,"l_shoulder":28.98,"r_shoulder":38.67,"l_hip":161.44,"r_hip":164.36,"l_knee":143.98,"r_knee":140.83,"trunk_lean":51.92},"origin":{"l_elbow":"observed","r_elbow":"observed","l_shoulder":"observed","r_shoulder":"observed","l_hip":"observed","r_hip":"observed","l_knee":"observed","r_knee":"observed","trunk_lean":"observed"}},{"t":333.3,"positions":[[-0.35,-0.3589,-0.0258],[-0.3359,-0.2469,-0.3277],[-0.2743,-0.1648,0.0766],[-0.2509,0.027,-0.3161],[-0.1289,-0.0998,0.077],[-0.1506,0.2514,-0.2891],[0.0087,-0.0416,0.1041],[-0.011,0.0421,-0.0985],[0.267,0.1273,0.288],[0.252,0.1445,0.0775],[0.2836,0.349,0.4736],[0.3039,0.3576,0.2889]],"confidence":[0.997,1.0,0.053,0.992,0.085,0.959,0.986,0.994,0.33,0.713,0.076,0.242],"angles":{"l_elbow":129.79,"r_elbow":172.12,"l_shoulder":27.64,"r_shoulder":39.14,"l_hip":162.63,"r_hip":161.88,"l_knee":136.82,"r_knee":135.83,"trunk_lean":51.86},"origin":{"l_elbow":"observed","r_elbow":"observed","l_shoulder":"observed","r_shoulder":"observed","l_hip":"observed","r_hip":"observed","l_knee":"observed","r_knee":"observed","trunk_lean":"observed"}},{"t":366.7,"positions":[[-0.3462,-0.3611,-0.0249],[-0.3404,-0.2438,-0.3253],[-0.2721,-0.1632,0.076],[-0.2513,0.0292,-0.3157],[-0.1143,-0.0842,0.0693],[-0.1485,0.2467,-0.289],[0.0101,-0.0446,0.1039],[-0.0121,0.0448,-0.0984],[0.2666,0.1179,0.2806],[0.2572,0.1303,0.0688],[0.3126,0.345,0.4564],[0.3085,0.3496,0.2538]],"confidence":[0.997,1.0,0.05,0.992,0.082,0.959,0.982,0.994,0.317,0.71,0.074,0.24],"angles":{"l_elbow":130.13,"r_elbow":171.55,"l_shoulder":28.04,"r_shoulder":38.84,"l_hip":162.69,"r_hip":159.07,"l_knee":141.32,"r_knee":131.57,"trunk_lean":51.89},"origin":{"l_elbow":"observed","r_elbow":"observed","l_shoulder":"observed","r_shoulder":"observed","l_hip":"observed","r_hip":"observed","l_knee":"observed","r_knee":"observed","trunk_lean":"observed"}},{"t":400.0,"positions":[[-0.344,-0.3613,0.0115],[-0.3427,-0.2441,-0.2998],[-0.2698,-0.1614,0.0982],[-0.2544,0.0283,-0.2948],[-0.1078,-0.0872,0.0828],[-0.1414,0.2431,-0.2747],[0.011,-0.0466,0.1037],[-0.0124,0.0452,-0.0974],[0.2752,0.1131,0.2565],[0.2862,0.1241,0.0443],[0.3515,0.3251,0.4064],[0.3599,0.3173,0.1864]],"confidence":[0.997,1.0,0.047,0.993,0.077,0.96,0.981,0.993,0.305,0.708,0.071,0.237],"angles":{"l_elbow":128.31,